{
  "schema_version": "1.0.0",
  "project_id": "remake_campaign_001",
  "artifact_id": "voiceover_asset_manifest",
  "created_at": "2026-06-27T11:21:08.780709Z",
  "source_artifacts": [
    "voiceover_script.json"
  ],
  "model_info": {
    "provider": "dry-run",
    "model": "deterministic-fixture",
    "temperature": 0.0
  },
  "cost_rmb": 0.0,
  "voiceover": {
    "status": "dry_run_placeholder",
    "path": "output/audio/voiceover.wav",
    "language": "Malay",
    "actual_cost_rmb": 0.0
  },
  "segments": [
    {
      "new_shot_id": "new_001",
      "max_duration_ms": 3000,
      "status": "dry_run_placeholder"
    },
    {
      "new_shot_id": "new_002",
      "max_duration_ms": 3000,
      "status": "dry_run_placeholder"
    },
    {
      "new_shot_id": "new_003",
      "max_duration_ms": 3000,
      "status": "dry_run_placeholder"
    },
    {
      "new_shot_id": "new_004",
      "max_duration_ms": 3000,
      "status": "dry_run_placeholder"
    },
    {
      "new_shot_id": "new_005",
      "max_duration_ms": 3000,
      "status": "dry_run_placeholder"
    },
    {
      "new_shot_id": "new_006",
      "max_duration_ms": 3000,
      "status": "dry_run_placeholder"
    },
    {
      "new_shot_id": "new_007",
      "max_duration_ms": 3000,
      "status": "dry_run_placeholder"
    },
    {
      "new_shot_id": "new_008",
      "max_duration_ms": 3000,
      "status": "dry_run_placeholder"
    },
    {
      "new_shot_id": "new_009",
      "max_duration_ms": 3000,
      "status": "dry_run_placeholder"
    },
    {
      "new_shot_id": "new_010",
      "max_duration_ms": 3000,
      "status": "dry_run_placeholder"
    },
    {
      "new_shot_id": "new_011",
      "max_duration_ms": 3000,
      "status": "dry_run_placeholder"
    },
    {
      "new_shot_id": "new_012",
      "max_duration_ms": 3000,
      "status": "dry_run_placeholder"
    },
    {
      "new_shot_id": "new_013",
      "max_duration_ms": 3000,
      "status": "dry_run_placeholder"
    },
    {
      "new_shot_id": "new_014",
      "max_duration_ms": 3000,
      "status": "dry_run_placeholder"
    },
    {
      "new_shot_id": "new_015",
      "max_duration_ms": 3000,
      "status": "dry_run_placeholder"
    },
    {
      "new_shot_id": "new_016",
      "max_duration_ms": 3000,
      "status": "dry_run_placeholder"
    },
    {
      "new_shot_id": "new_017",
      "max_duration_ms": 3000,
      "status": "dry_run_placeholder"
    },
    {
      "new_shot_id": "new_018",
      "max_duration_ms": 3000,
      "status": "dry_run_placeholder"
    },
    {
      "new_shot_id": "new_019",
      "max_duration_ms": 3000,
      "status": "dry_run_placeholder"
    },
    {
      "new_shot_id": "new_020",
      "max_duration_ms": 3000,
      "status": "dry_run_placeholder"
    }
  ]
}
